{
	"$schema": "./projInfo-schema.json",

	"title": "Super Auto Coots",
	"description": "A project made in Profectus",
	"id": "superautocoots",
	"author": "",
	"discordName": "",
	"discordLink": "",

	"versionNumber": "0.0.0",
	"versionTitle": "Initial Commit",

	"allowGoBack": false,
	"defaultShowSmall": false,
	"defaultDecimalsShown": 2,
	"useHeader": true,
	"banner": null,
	"logo": "",
	"initialTabs": [ "main" ],

	"maxTickLength": 3600,
	"offlineLimit": 1,
	"enablePausing": true,
	"exportEncoding": "base64"
}
